{
  "$schema": "https://json-schema.org/draft/2020-12/schema",
  "$id": "urn:tsto:schema:00",
  "title": "TSTO/00 Target State Transition Object",
  "type": "object",
  "additionalProperties": false,
  "required": [
    "spec",
    "id",
    "type",
    "issued_at",
    "profile",
    "subject",
    "baseline",
    "target",
    "validity",
    "constraints",
    "verification",
    "integrity"
  ],
  "properties": {
    "spec": { "const": "TSTO/00" },
    "id": { "type": "string", "format": "uri" },
    "type": { "const": "TargetStateTransition" },
    "issued_at": { "type": "string", "format": "date-time" },
    "profile": { "$ref": "#/$defs/immutableResourceRef" },
    "subject": { "$ref": "#/$defs/subject" },
    "baseline": { "$ref": "#/$defs/baseline" },
    "target": { "$ref": "#/$defs/target" },
    "validity": { "$ref": "#/$defs/validity" },
    "constraints": {
      "type": "array",
      "items": { "$ref": "#/$defs/constraint" }
    },
    "verification": { "$ref": "#/$defs/verification" },
    "integrity": { "$ref": "#/$defs/integrity" }
  },
  "$defs": {
    "digest": {
      "type": "string",
      "pattern": "^sha-256:[A-Za-z0-9_-]{43}$"
    },
    "immutableResourceRef": {
      "type": "object",
      "additionalProperties": false,
      "required": ["id", "digest"],
      "properties": {
        "id": { "type": "string", "format": "uri" },
        "digest": { "$ref": "#/$defs/digest" }
      }
    },
    "subject": {
      "type": "object",
      "additionalProperties": false,
      "required": ["id", "type"],
      "properties": {
        "id": { "type": "string", "format": "uri" },
        "type": { "type": "string", "minLength": 1 },
        "version": { "type": "string", "minLength": 1 }
      }
    },
    "evidenceRef": {
      "type": "object",
      "additionalProperties": false,
      "required": ["id", "kind", "digest", "observed_at"],
      "properties": {
        "id": { "type": "string", "format": "uri" },
        "kind": { "type": "string", "minLength": 1 },
        "digest": { "$ref": "#/$defs/digest" },
        "observed_at": { "type": "string", "format": "date-time" },
        "media_type": { "type": "string", "minLength": 1 },
        "location": { "type": "string", "format": "uri" }
      }
    },
    "pointer": {
      "type": "string",
      "pattern": "^(?:/(?:[^~/]|~[01])*)+$"
    },
    "comparisonPredicate": {
      "type": "object",
      "additionalProperties": false,
      "required": ["op", "path", "value"],
      "properties": {
        "op": {
          "enum": ["eq", "ne", "lt", "lte", "gt", "gte", "in", "contains"]
        },
        "path": { "$ref": "#/$defs/pointer" },
        "value": true
      }
    },
    "existsPredicate": {
      "type": "object",
      "additionalProperties": false,
      "required": ["op", "path", "value"],
      "properties": {
        "op": { "const": "exists" },
        "path": { "$ref": "#/$defs/pointer" },
        "value": { "type": "boolean" }
      }
    },
    "listPredicate": {
      "type": "object",
      "additionalProperties": false,
      "required": ["op", "args"],
      "properties": {
        "op": { "enum": ["all", "any"] },
        "args": {
          "type": "array",
          "minItems": 1,
          "items": { "$ref": "#/$defs/predicate" }
        }
      }
    },
    "notPredicate": {
      "type": "object",
      "additionalProperties": false,
      "required": ["op", "arg"],
      "properties": {
        "op": { "const": "not" },
        "arg": { "$ref": "#/$defs/predicate" }
      }
    },
    "predicate": {
      "oneOf": [
        { "$ref": "#/$defs/comparisonPredicate" },
        { "$ref": "#/$defs/existsPredicate" },
        { "$ref": "#/$defs/listPredicate" },
        { "$ref": "#/$defs/notPredicate" }
      ]
    },
    "baseline": {
      "type": "object",
      "additionalProperties": false,
      "required": ["observed_at", "claims", "evidence"],
      "properties": {
        "observed_at": { "type": "string", "format": "date-time" },
        "claims": {
          "type": "array",
          "minItems": 1,
          "items": { "$ref": "#/$defs/predicate" }
        },
        "evidence": {
          "type": "array",
          "minItems": 1,
          "items": { "$ref": "#/$defs/evidenceRef" }
        }
      }
    },
    "target": {
      "type": "object",
      "additionalProperties": false,
      "required": ["claims"],
      "properties": {
        "claims": {
          "type": "array",
          "minItems": 1,
          "items": { "$ref": "#/$defs/predicate" }
        }
      }
    },
    "validity": {
      "type": "object",
      "additionalProperties": false,
      "required": ["achieve_by", "verify_by"],
      "properties": {
        "not_before": { "type": "string", "format": "date-time" },
        "achieve_by": { "type": "string", "format": "date-time" },
        "verify_by": { "type": "string", "format": "date-time" },
        "sustain_for": { "type": "string", "format": "duration" }
      }
    },
    "constraint": {
      "type": "object",
      "additionalProperties": false,
      "required": ["id", "scope", "predicate"],
      "properties": {
        "id": { "type": "string", "minLength": 1 },
        "scope": { "enum": ["at_target", "interval"] },
        "predicate": { "$ref": "#/$defs/predicate" }
      }
    },
    "verification": {
      "type": "object",
      "additionalProperties": false,
      "required": ["policy"],
      "properties": {
        "policy": { "$ref": "#/$defs/immutableResourceRef" },
        "parameters": { "type": "object" }
      }
    },
    "integrity": {
      "type": "object",
      "additionalProperties": false,
      "required": ["alg", "canonicalization", "value"],
      "properties": {
        "alg": { "const": "sha-256" },
        "canonicalization": { "const": "RFC8785" },
        "value": { "$ref": "#/$defs/digest" }
      }
    }
  }
}
